smartctl 7.5 2025-04-30 r5714 [x86_64-linux-7.0.0-10-generic] (local build)
Copyright (C) 2002-25, Bruce Allen, Christian Franke, www.smartmontools.org

=== START OF INFORMATION SECTION ===
Model Number:                       CT4000P3SSD8
Serial Number:                      2342E8812937
Firmware Version:                   P9CR30A
PCI Vendor/Subsystem ID:            0xc0a9
IEEE OUI Identifier:                0x00a075
Controller ID:                      1
NVMe Version:                       1.4
Number of Namespaces:               1
Namespace 1 Size/Capacity:          4,000,787,030,016 [4.00 TB]
Namespace 1 Formatted LBA Size:     512
Namespace 1 IEEE EUI-64:            6479a7 8440000119
Local Time is:                      Tue Apr  7 09:36:27 2026 UTC
Firmware Updates (0x12):            1 Slot, no Reset required
Optional Admin Commands (0x0017):   Security Format Frmw_DL Self_Test
Optional NVM Commands (0x005e):     Wr_Unc DS_Mngmt Wr_Zero Sav/Sel_Feat Timestmp
Log Page Attributes (0x06):         Cmd_Eff_Lg Ext_Get_Lg
Maximum Data Transfer Size:         64 Pages
Warning  Comp. Temp. Threshold:     85 Celsius
Critical Comp. Temp. Threshold:     95 Celsius

Supported Power States
St Op     Max   Active     Idle   RL RT WL WT  Ent_Lat  Ex_Lat
 0 +     6.00W  0.0000W       -    0  0  0  0        0       0
 1 +     3.00W  0.0000W       -    0  0  0  0        0       0
 2 +     1.50W  0.0000W       -    0  0  0  0        0       0
 3 -   0.0250W  0.0000W       -    3  3  3  3     5000    1900
 4 -   0.0030W       -        -    4  4  4  4    13000  100000

Supported LBA Sizes (NSID 0x1)
Id Fmt  Data  Metadt  Rel_Perf
 0 +     512       0         1
 1 -    4096       0         0

=== START OF SMART DATA SECTION ===
SMART overall-health self-assessment test result: PASSED

SMART/Health Information (NVMe Log 0x02, NSID 0xffffffff)
Critical Warning:                   0x00
Temperature:                        30 Celsius
Available Spare:                    100%
Available Spare Threshold:          5%
Percentage Used:                    7%
Data Units Read:                    33,661,128 [17.2 TB]
Data Units Written:                 20,071,496 [10.2 TB]
Host Read Commands:                 159,532,755
Host Write Commands:                119,528,208
Controller Busy Time:               1,892
Power Cycles:                       48
Power On Hours:                     18,161
Unsafe Shutdowns:                   36
Media and Data Integrity Errors:    0
Error Information Log Entries:      264
Warning  Comp. Temperature Time:    3
Critical Comp. Temperature Time:    0
Temperature Sensor 1:               30 Celsius
Temperature Sensor 2:               35 Celsius
Temperature Sensor 8:               30 Celsius
Thermal Temp. 1 Transition Count:   1
Thermal Temp. 1 Total Time:         2924

Error Information (NVMe Log 0x01, 16 of 16 entries)
Num   ErrCount  SQId   CmdId  Status  PELoc          LBA  NSID    VS  Message
  0        264     0  0x0012  0x4005  0x028            0     0     -  Invalid Field in Command

Self-test Log (NVMe Log 0x06, NSID 0xffffffff)
Self-test status: No self-test in progress
No Self-tests Logged

