smartctl 7.5 2025-04-30 r5714 [x86_64-linux-7.0.0-10-generic] (local build)
Copyright (C) 2002-25, Bruce Allen, Christian Franke, www.smartmontools.org

=== START OF INFORMATION SECTION ===
Model Number:                       KINGSTON SNV2S1000G
Serial Number:                      50026B7283094B2F
Firmware Version:                   SBM02103
PCI Vendor/Subsystem ID:            0x2646
IEEE OUI Identifier:                0x0026b7
Controller ID:                      1
NVMe Version:                       1.4
Number of Namespaces:               1
Namespace 1 Size/Capacity:          1,000,204,886,016 [1.00 TB]
Namespace 1 Formatted LBA Size:     512
Namespace 1 IEEE EUI-64:            0026b7 283094b2f5
Local Time is:                      Tue Apr  7 09:48:57 2026 UTC
Firmware Updates (0x12):            1 Slot, no Reset required
Optional Admin Commands (0x0016):   Format Frmw_DL Self_Test
Optional NVM Commands (0x009f):     Comp Wr_Unc DS_Mngmt Wr_Zero Sav/Sel_Feat Verify
Log Page Attributes (0x12):         Cmd_Eff_Lg Pers_Ev_Lg
Maximum Data Transfer Size:         64 Pages
Warning  Comp. Temp. Threshold:     83 Celsius
Critical Comp. Temp. Threshold:     90 Celsius

Supported Power States
St Op     Max   Active     Idle   RL RT WL WT  Ent_Lat  Ex_Lat
 0 +     5.00W       -        -    0  0  0  0        0       0
 1 +     3.50W       -        -    1  1  1  1        0     200
 2 +     2.50W       -        -    2  2  2  2        0    1000
 3 -     1.50W       -        -    3  3  3  3     5000    5000
 4 -     1.50W       -        -    4  4  4  4    20000   70000

Supported LBA Sizes (NSID 0x1)
Id Fmt  Data  Metadt  Rel_Perf
 0 +     512       0         0

=== START OF SMART DATA SECTION ===
SMART overall-health self-assessment test result: PASSED

SMART/Health Information (NVMe Log 0x02, NSID 0xffffffff)
Critical Warning:                   0x00
Temperature:                        32 Celsius
Available Spare:                    100%
Available Spare Threshold:          10%
Percentage Used:                    0%
Data Units Read:                    3,270,761 [1.67 TB]
Data Units Written:                 7,494,478 [3.83 TB]
Host Read Commands:                 38,953,535
Host Write Commands:                158,256,064
Controller Busy Time:               17,293
Power Cycles:                       66
Power On Hours:                     19,002
Unsafe Shutdowns:                   10
Media and Data Integrity Errors:    0
Error Information Log Entries:      0
Warning  Comp. Temperature Time:    6616
Critical Comp. Temperature Time:    1434

Error Information (NVMe Log 0x01, 16 of 64 entries)
No Errors Logged

Self-test Log (NVMe Log 0x06, NSID 0xffffffff)
Self-test status: No self-test in progress
No Self-tests Logged

